{"metric":"vo2max","points":[{"date":"2026-10-03","value":50.0},{"date":"2026-10-04","value":50.0},{"date":"2026-10-06","value":50.0},{"date":"2026-10-08","value":50.0},{"date":"2026-10-09","value":51.0},{"date":"2026-10-12","value":51.0},{"date":"2026-10-13","value":51.0},{"date":"2026-10-15","value":51.0},{"date":"2026-10-16","value":51.0},{"date":"2026-10-19","value":52.0},{"date":"2026-10-21","value":52.0},{"date":"2026-10-23","value":52.0}],"schema_version":1,"unit":"ml/kg/min"}
