{"schema_version":1,"metric":"hrv","unit":"ms","points":[{"date":"2025-09-01","value":42},{"date":"2025-09-02","value":38},{"date":"2025-09-03","value":37},{"date":"2025-09-04","value":41},{"date":"2025-09-05","value":41},{"date":"2025-09-06","value":36},{"date":"2025-09-07","value":48},{"date":"2025-09-08","value":42},{"date":"2025-09-09","value":42},{"date":"2025-09-10","value":47},{"date":"2025-09-11","value":40},{"date":"2025-09-12","value":48},{"date":"2025-09-13","value":38},{"date":"2025-09-14","value":38},{"date":"2025-09-15","value":46},{"date":"2025-09-16","value":47},{"date":"2025-09-17","value":43},{"date":"2025-09-18","value":46},{"date":"2025-09-19","value":36},{"date":"2025-09-20","value":39},{"date":"2025-09-21","value":41},{"date":"2025-09-22","value":37},{"date":"2025-09-23","value":46},{"date":"2025-09-24","value":49},{"date":"2025-09-25","value":38},{"date":"2025-09-26","value":36},{"date":"2025-09-28","value":47},{"date":"2025-09-30","value":38},{"date":"2025-10-02","value":42},{"date":"2025-10-03","value":36},{"date":"2025-10-04","value":38},{"date":"2025-10-05","value":49},{"date":"2025-10-06","value":49},{"date":"2025-10-07","value":38},{"date":"2025-10-08","value":47},{"date":"2025-10-10","value":40},{"date":"2025-10-11","value":43},{"date":"2025-10-12","value":45},{"date":"2025-10-13","value":40},{"date":"2025-10-14","value":36},{"date":"2025-10-15","value":43},{"date":"2025-10-16","value":48},{"date":"2025-10-17","value":49},{"date":"2025-10-20","value":39},{"date":"2025-10-21","value":49},{"date":"2025-10-22","value":42},{"date":"2025-10-23","value":44},{"date":"2025-10-24","value":50},{"date":"2025-10-25","value":40},{"date":"2025-10-26","value":46},{"date":"2025-10-27","value":44},{"date":"2025-10-29","value":38},{"date":"2025-10-30","value":42},{"date":"2025-10-31","value":41},{"date":"2025-11-01","value":40},{"date":"2025-11-02","value":45},{"date":"2025-11-03","value":45},{"date":"2025-11-04","value":47},{"date":"2025-11-05","value":48},{"date":"2025-11-06","value":38},{"date":"2025-11-07","value":36},{"date":"2025-11-08","value":41},{"date":"2025-11-10","value":39},{"date":"2025-11-11","value":40},{"date":"2025-11-12","value":38},{"date":"2025-11-13","value":41},{"date":"2025-11-14","value":37},{"date":"2025-11-15","value":47},{"date":"2025-11-16","value":46},{"date":"2025-11-17","value":47},{"date":"2025-11-18","value":48},{"date":"2025-11-19","value":45},{"date":"2025-11-20","value":48},{"date":"2025-11-21","value":38},{"date":"2025-11-22","value":42},{"date":"2025-11-23","value":47},{"date":"2025-11-24","value":42},{"date":"2025-11-25","value":40},{"date":"2025-11-26","value":40},{"date":"2025-11-27","value":37},{"date":"2025-11-28","value":40},{"date":"2025-11-29","value":38},{"date":"2025-11-30","value":44},{"date":"2025-12-01","value":46},{"date":"2025-12-02","value":47},{"date":"2025-12-03","value":40},{"date":"2025-12-04","value":39},{"date":"2025-12-05","value":42},{"date":"2025-12-06","value":39},{"date":"2025-12-07","value":39},{"date":"2025-12-08","value":38},{"date":"2025-12-09","value":38},{"date":"2025-12-10","value":43},{"date":"2025-12-11","value":49},{"date":"2025-12-13","value":40},{"date":"2025-12-14","value":45},{"date":"2025-12-15","value":38},{"date":"2025-12-16","value":39},{"date":"2025-12-17","value":39},{"date":"2025-12-18","value":48},{"date":"2025-12-19","value":46},{"date":"2025-12-20","value":50},{"date":"2025-12-21","value":40},{"date":"2025-12-22","value":44},{"date":"2025-12-23","value":50},{"date":"2025-12-24","value":44},{"date":"2025-12-25","value":46},{"date":"2025-12-26","value":40},{"date":"2025-12-28","value":45},{"date":"2025-12-29","value":38},{"date":"2025-12-30","value":47},{"date":"2025-12-31","value":40}]}
