{"metric":"body_fat_pct","points":[{"date":"2025-10-21","value":32.5},{"date":"2025-10-22","value":31.3},{"date":"2025-10-24","value":32.2},{"date":"2025-10-25","value":31.7},{"date":"2025-10-28","value":32.4},{"date":"2025-10-29","value":31.1},{"date":"2025-10-30","value":31.9},{"date":"2025-10-31","value":31.9},{"date":"2025-11-03","value":31.2},{"date":"2025-11-04","value":30.3},{"date":"2025-11-05","value":30.8},{"date":"2025-11-06","value":31.8},{"date":"2025-11-07","value":31.7},{"date":"2025-11-09","value":30.8},{"date":"2025-11-10","value":30.3},{"date":"2025-11-11","value":31.0},{"date":"2025-11-12","value":31.1},{"date":"2025-11-13","value":31.1},{"date":"2025-11-14","value":30.3},{"date":"2025-11-16","value":30.9},{"date":"2025-11-18","value":30.2},{"date":"2025-11-19","value":30.6},{"date":"2025-11-20","value":30.1},{"date":"2025-11-21","value":30.2},{"date":"2025-11-23","value":30.6},{"date":"2025-11-25","value":29.7},{"date":"2025-11-26","value":29.6},{"date":"2025-11-27","value":30.6},{"date":"2025-11-28","value":29.8},{"date":"2025-11-30","value":29.8},{"date":"2025-12-02","value":30.5},{"date":"2025-12-04","value":29.4},{"date":"2025-12-05","value":29.7},{"date":"2025-12-06","value":30.0},{"date":"2025-12-07","value":29.4},{"date":"2025-12-08","value":29.0},{"date":"2025-12-09","value":29.7},{"date":"2025-12-10","value":29.1},{"date":"2025-12-11","value":30.0},{"date":"2025-12-12","value":28.5},{"date":"2025-12-15","value":28.9},{"date":"2025-12-17","value":29.1},{"date":"2025-12-18","value":28.3},{"date":"2025-12-19","value":28.8},{"date":"2025-12-21","value":28.5},{"date":"2025-12-23","value":28.4},{"date":"2025-12-24","value":28.7},{"date":"2025-12-31","value":28.8}],"schema_version":1,"unit":"%"}
