{"metric":"resting_hr","points":[{"date":"2025-10-17","value":53.0},{"date":"2025-10-18","value":49.0},{"date":"2025-10-19","value":50.0},{"date":"2025-10-20","value":51.0},{"date":"2025-10-21","value":52.0},{"date":"2025-10-22","value":51.0},{"date":"2025-10-23","value":53.0},{"date":"2025-10-24","value":51.0},{"date":"2025-10-25","value":50.0},{"date":"2025-10-26","value":54.0},{"date":"2025-10-27","value":44.0},{"date":"2025-10-28","value":51.0},{"date":"2025-10-29","value":50.0},{"date":"2025-10-30","value":52.0},{"date":"2025-10-31","value":47.0},{"date":"2025-11-01","value":49.0},{"date":"2025-11-02","value":49.0},{"date":"2025-11-03","value":50.0},{"date":"2025-11-04","value":49.0},{"date":"2025-11-05","value":49.0},{"date":"2025-11-06","value":52.0},{"date":"2025-11-07","value":52.0},{"date":"2025-11-08","value":53.0},{"date":"2025-11-09","value":52.0},{"date":"2025-11-10","value":50.0},{"date":"2025-11-11","value":52.0},{"date":"2025-11-12","value":51.0},{"date":"2025-11-13","value":47.0},{"date":"2025-11-14","value":49.0},{"date":"2025-11-15","value":49.0},{"date":"2025-11-16","value":50.0},{"date":"2025-11-17","value":47.0},{"date":"2025-11-18","value":48.0},{"date":"2025-11-19","value":51.0},{"date":"2025-11-20","value":49.0},{"date":"2025-11-21","value":49.0},{"date":"2025-11-22","value":51.0},{"date":"2025-11-23","value":48.0},{"date":"2025-11-24","value":47.0},{"date":"2025-11-25","value":48.0},{"date":"2025-11-26","value":45.0},{"date":"2025-11-27","value":50.0},{"date":"2025-11-28","value":50.0},{"date":"2025-11-29","value":52.0},{"date":"2025-11-30","value":49.0},{"date":"2025-12-01","value":50.0},{"date":"2025-12-02","value":47.0},{"date":"2025-12-03","value":50.0},{"date":"2025-12-04","value":50.0},{"date":"2025-12-05","value":48.0},{"date":"2025-12-06","value":48.0},{"date":"2025-12-07","value":49.0},{"date":"2025-12-08","value":47.0},{"date":"2025-12-09","value":43.0},{"date":"2025-12-10","value":48.0},{"date":"2025-12-11","value":45.0},{"date":"2025-12-12","value":48.0},{"date":"2025-12-13","value":45.0},{"date":"2025-12-14","value":47.0},{"date":"2025-12-15","value":44.0},{"date":"2025-12-16","value":46.0},{"date":"2025-12-17","value":46.0},{"date":"2025-12-18","value":46.0},{"date":"2025-12-19","value":47.0},{"date":"2025-12-20","value":50.0},{"date":"2025-12-21","value":47.0},{"date":"2025-12-22","value":48.0},{"date":"2025-12-23","value":47.0},{"date":"2025-12-24","value":47.0},{"date":"2025-12-25","value":47.0},{"date":"2025-12-26","value":51.0},{"date":"2025-12-27","value":50.0},{"date":"2025-12-28","value":48.0},{"date":"2025-12-29","value":51.0},{"date":"2025-12-30","value":47.0},{"date":"2025-12-31","value":50.0}],"schema_version":1,"unit":"bpm"}
