{"schema_version":1,"metric":"resting_hr","unit":"bpm","points":[{"date":"2026-01-02","value":51},{"date":"2026-01-03","value":49},{"date":"2026-01-04","value":51},{"date":"2026-01-05","value":51},{"date":"2026-01-06","value":50},{"date":"2026-01-08","value":49},{"date":"2026-01-09","value":50},{"date":"2026-01-10","value":49},{"date":"2026-01-11","value":52},{"date":"2026-01-12","value":52},{"date":"2026-01-13","value":49},{"date":"2026-01-14","value":50},{"date":"2026-01-15","value":51},{"date":"2026-01-16","value":52},{"date":"2026-01-17","value":52},{"date":"2026-01-19","value":50},{"date":"2026-01-20","value":50},{"date":"2026-01-21","value":51},{"date":"2026-01-22","value":51},{"date":"2026-01-23","value":51},{"date":"2026-01-24","value":49},{"date":"2026-01-25","value":49},{"date":"2026-01-26","value":51},{"date":"2026-01-27","value":52},{"date":"2026-01-28","value":51},{"date":"2026-01-29","value":49},{"date":"2026-01-30","value":51},{"date":"2026-01-31","value":50},{"date":"2026-02-01","value":50},{"date":"2026-02-02","value":49},{"date":"2026-02-03","value":51},{"date":"2026-02-04","value":51},{"date":"2026-02-05","value":52},{"date":"2026-02-06","value":49},{"date":"2026-02-07","value":51},{"date":"2026-02-09","value":51},{"date":"2026-02-10","value":48},{"date":"2026-02-11","value":48},{"date":"2026-02-12","value":50},{"date":"2026-02-13","value":50},{"date":"2026-02-14","value":51},{"date":"2026-02-15","value":49},{"date":"2026-02-16","value":49},{"date":"2026-02-17","value":51},{"date":"2026-02-18","value":50},{"date":"2026-02-19","value":49},{"date":"2026-02-20","value":52},{"date":"2026-02-21","value":49},{"date":"2026-02-23","value":49},{"date":"2026-02-24","value":49},{"date":"2026-02-25","value":49},{"date":"2026-02-26","value":49},{"date":"2026-02-27","value":49},{"date":"2026-02-28","value":49},{"date":"2026-03-01","value":51},{"date":"2026-03-02","value":51},{"date":"2026-03-03","value":51},{"date":"2026-03-04","value":50},{"date":"2026-03-05","value":49},{"date":"2026-03-06","value":48},{"date":"2026-03-07","value":48},{"date":"2026-03-08","value":50},{"date":"2026-03-10","value":51},{"date":"2026-03-11","value":49},{"date":"2026-03-12","value":51},{"date":"2026-03-13","value":52},{"date":"2026-03-14","value":52},{"date":"2026-03-15","value":51},{"date":"2026-03-16","value":51},{"date":"2026-03-17","value":49},{"date":"2026-03-18","value":51},{"date":"2026-03-19","value":48},{"date":"2026-03-21","value":48},{"date":"2026-03-22","value":49},{"date":"2026-03-23","value":48},{"date":"2026-03-24","value":50},{"date":"2026-03-25","value":50},{"date":"2026-03-26","value":48},{"date":"2026-03-28","value":48},{"date":"2026-03-29","value":48},{"date":"2026-03-31","value":51},{"date":"2026-04-01","value":48},{"date":"2026-04-02","value":51},{"date":"2026-04-03","value":48},{"date":"2026-04-04","value":49},{"date":"2026-04-05","value":51},{"date":"2026-04-06","value":50},{"date":"2026-04-07","value":48},{"date":"2026-04-08","value":48},{"date":"2026-04-09","value":49},{"date":"2026-04-10","value":50},{"date":"2026-04-11","value":51},{"date":"2026-04-12","value":50},{"date":"2026-04-13","value":51},{"date":"2026-04-14","value":49},{"date":"2026-04-16","value":50},{"date":"2026-04-17","value":51},{"date":"2026-04-18","value":47},{"date":"2026-04-19","value":51},{"date":"2026-04-20","value":47},{"date":"2026-04-21","value":51},{"date":"2026-04-22","value":50},{"date":"2026-04-23","value":49},{"date":"2026-04-24","value":50},{"date":"2026-04-25","value":48},{"date":"2026-04-26","value":48},{"date":"2026-04-27","value":48},{"date":"2026-04-28","value":51},{"date":"2026-04-29","value":48},{"date":"2026-04-30","value":51},{"date":"2026-05-01","value":49},{"date":"2026-05-02","value":49},{"date":"2026-05-04","value":51},{"date":"2026-05-05","value":48},{"date":"2026-05-06","value":49},{"date":"2026-05-07","value":50},{"date":"2026-05-08","value":48},{"date":"2026-05-09","value":49},{"date":"2026-05-10","value":48},{"date":"2026-05-11","value":50},{"date":"2026-05-12","value":51},{"date":"2026-05-13","value":51},{"date":"2026-05-14","value":48},{"date":"2026-05-15","value":51},{"date":"2026-05-16","value":49},{"date":"2026-05-17","value":51},{"date":"2026-05-18","value":48},{"date":"2026-05-19","value":50},{"date":"2026-05-20","value":48},{"date":"2026-05-21","value":48},{"date":"2026-05-22","value":49},{"date":"2026-05-23","value":49},{"date":"2026-05-24","value":49},{"date":"2026-05-25","value":48},{"date":"2026-05-26","value":51},{"date":"2026-05-27","value":47},{"date":"2026-05-28","value":51},{"date":"2026-05-29","value":51},{"date":"2026-05-30","value":50},{"date":"2026-05-31","value":50},{"date":"2026-06-02","value":47},{"date":"2026-06-04","value":48},{"date":"2026-06-05","value":47},{"date":"2026-06-06","value":49},{"date":"2026-06-07","value":48},{"date":"2026-06-09","value":48},{"date":"2026-06-10","value":51},{"date":"2026-06-11","value":48},{"date":"2026-06-12","value":47},{"date":"2026-06-13","value":50},{"date":"2026-06-14","value":47},{"date":"2026-06-15","value":50},{"date":"2026-06-16","value":48},{"date":"2026-06-17","value":49},{"date":"2026-06-18","value":48},{"date":"2026-06-19","value":47},{"date":"2026-06-20","value":47},{"date":"2026-06-21","value":49},{"date":"2026-06-22","value":47},{"date":"2026-06-23","value":48},{"date":"2026-06-24","value":50},{"date":"2026-06-25","value":47},{"date":"2026-06-26","value":48},{"date":"2026-06-27","value":47},{"date":"2026-06-28","value":50},{"date":"2026-06-29","value":50},{"date":"2026-06-30","value":49},{"date":"2026-07-01","value":47},{"date":"2026-07-02","value":48},{"date":"2026-07-04","value":48},{"date":"2026-07-05","value":50},{"date":"2026-07-07","value":49},{"date":"2026-07-08","value":50},{"date":"2026-07-09","value":47},{"date":"2026-07-10","value":49},{"date":"2026-07-11","value":47},{"date":"2026-07-12","value":47},{"date":"2026-07-13","value":49},{"date":"2026-07-14","value":47},{"date":"2026-07-15","value":48},{"date":"2026-07-16","value":48},{"date":"2026-07-18","value":50},{"date":"2026-07-19","value":50},{"date":"2026-07-20","value":50},{"date":"2026-07-21","value":50},{"date":"2026-07-22","value":49},{"date":"2026-07-24","value":49},{"date":"2026-07-25","value":49},{"date":"2026-07-26","value":48},{"date":"2026-07-27","value":46},{"date":"2026-07-28","value":47},{"date":"2026-07-29","value":49},{"date":"2026-07-30","value":48},{"date":"2026-07-31","value":49},{"date":"2026-08-01","value":48},{"date":"2026-08-02","value":49},{"date":"2026-08-03","value":50},{"date":"2026-08-04","value":50},{"date":"2026-08-05","value":47},{"date":"2026-08-06","value":47},{"date":"2026-08-07","value":48},{"date":"2026-08-08","value":50},{"date":"2026-08-09","value":50},{"date":"2026-08-10","value":49},{"date":"2026-08-11","value":48},{"date":"2026-08-12","value":47},{"date":"2026-08-13","value":49},{"date":"2026-08-14","value":46},{"date":"2026-08-15","value":47},{"date":"2026-08-16","value":47},{"date":"2026-08-17","value":47},{"date":"2026-08-19","value":50},{"date":"2026-08-20","value":48},{"date":"2026-08-22","value":47},{"date":"2026-08-23","value":49},{"date":"2026-08-24","value":46},{"date":"2026-08-25","value":49},{"date":"2026-08-26","value":48},{"date":"2026-08-27","value":46},{"date":"2026-08-28","value":48},{"date":"2026-08-30","value":49},{"date":"2026-08-31","value":47},{"date":"2026-09-01","value":49},{"date":"2026-09-02","value":48},{"date":"2026-09-03","value":49},{"date":"2026-09-04","value":49},{"date":"2026-09-05","value":47},{"date":"2026-09-06","value":48},{"date":"2026-09-07","value":46},{"date":"2026-09-08","value":48},{"date":"2026-09-09","value":49},{"date":"2026-09-10","value":49},{"date":"2026-09-11","value":46},{"date":"2026-09-12","value":46},{"date":"2026-09-14","value":46},{"date":"2026-09-15","value":49},{"date":"2026-09-16","value":46},{"date":"2026-09-19","value":48},{"date":"2026-09-20","value":48},{"date":"2026-09-21","value":48},{"date":"2026-09-22","value":46},{"date":"2026-09-23","value":47},{"date":"2026-09-24","value":49},{"date":"2026-09-25","value":46},{"date":"2026-09-26","value":46},{"date":"2026-09-27","value":47},{"date":"2026-09-28","value":49},{"date":"2026-09-29","value":47},{"date":"2026-10-01","value":49},{"date":"2026-10-02","value":46},{"date":"2026-10-03","value":47},{"date":"2026-10-04","value":47},{"date":"2026-10-05","value":49},{"date":"2026-10-06","value":47},{"date":"2026-10-07","value":49},{"date":"2026-10-08","value":47},{"date":"2026-10-09","value":46},{"date":"2026-10-10","value":49},{"date":"2026-10-11","value":48},{"date":"2026-10-12","value":47},{"date":"2026-10-13","value":48},{"date":"2026-10-14","value":47},{"date":"2026-10-15","value":49},{"date":"2026-10-16","value":47},{"date":"2026-10-17","value":48},{"date":"2026-10-18","value":48},{"date":"2026-10-19","value":49},{"date":"2026-10-20","value":47},{"date":"2026-10-21","value":46},{"date":"2026-10-22","value":46},{"date":"2026-10-23","value":45},{"date":"2026-10-24","value":47}]}
