{"schema_version":1,"metric":"vo2max","unit":"ml/kg/min","points":[{"date":"2026-01-02","value":51},{"date":"2026-01-05","value":51},{"date":"2026-01-08","value":51},{"date":"2026-01-11","value":51},{"date":"2026-01-14","value":51},{"date":"2026-01-17","value":51},{"date":"2026-01-20","value":51},{"date":"2026-01-23","value":51},{"date":"2026-01-26","value":51},{"date":"2026-01-29","value":51},{"date":"2026-02-01","value":51},{"date":"2026-02-04","value":51},{"date":"2026-02-07","value":51},{"date":"2026-02-10","value":51},{"date":"2026-02-13","value":51},{"date":"2026-02-16","value":51},{"date":"2026-02-19","value":51},{"date":"2026-02-22","value":51},{"date":"2026-02-25","value":51},{"date":"2026-02-28","value":51},{"date":"2026-03-03","value":52},{"date":"2026-03-06","value":52},{"date":"2026-03-09","value":52},{"date":"2026-03-12","value":52},{"date":"2026-03-15","value":54},{"date":"2026-03-18","value":52},{"date":"2026-03-21","value":52},{"date":"2026-03-24","value":52},{"date":"2026-03-27","value":52},{"date":"2026-03-30","value":52},{"date":"2026-04-02","value":52},{"date":"2026-04-05","value":52},{"date":"2026-04-08","value":52},{"date":"2026-04-11","value":52},{"date":"2026-04-14","value":52},{"date":"2026-04-17","value":52},{"date":"2026-04-20","value":52},{"date":"2026-04-23","value":52},{"date":"2026-04-26","value":52},{"date":"2026-04-29","value":52},{"date":"2026-05-02","value":52},{"date":"2026-05-05","value":52},{"date":"2026-05-08","value":52},{"date":"2026-05-11","value":52},{"date":"2026-05-14","value":52},{"date":"2026-05-17","value":52},{"date":"2026-05-20","value":52},{"date":"2026-05-23","value":52},{"date":"2026-05-26","value":52},{"date":"2026-05-29","value":52},{"date":"2026-06-01","value":52},{"date":"2026-06-04","value":53},{"date":"2026-06-07","value":53},{"date":"2026-06-10","value":53},{"date":"2026-06-13","value":53},{"date":"2026-06-16","value":53},{"date":"2026-06-19","value":53},{"date":"2026-06-22","value":53},{"date":"2026-06-25","value":53},{"date":"2026-06-28","value":53},{"date":"2026-07-01","value":53},{"date":"2026-07-04","value":53},{"date":"2026-07-07","value":53},{"date":"2026-07-10","value":53},{"date":"2026-07-13","value":53},{"date":"2026-07-16","value":53},{"date":"2026-07-19","value":53},{"date":"2026-07-22","value":53},{"date":"2026-07-25","value":53},{"date":"2026-07-28","value":53},{"date":"2026-07-31","value":53},{"date":"2026-08-03","value":53},{"date":"2026-08-06","value":53},{"date":"2026-08-09","value":53},{"date":"2026-08-12","value":53},{"date":"2026-08-15","value":53},{"date":"2026-08-18","value":53},{"date":"2026-08-21","value":53},{"date":"2026-08-24","value":53},{"date":"2026-08-27","value":53},{"date":"2026-08-30","value":53},{"date":"2026-09-02","value":53},{"date":"2026-09-05","value":53},{"date":"2026-09-08","value":54},{"date":"2026-09-11","value":54},{"date":"2026-09-14","value":54},{"date":"2026-09-17","value":54},{"date":"2026-09-20","value":54},{"date":"2026-09-23","value":54},{"date":"2026-09-26","value":54},{"date":"2026-09-29","value":54},{"date":"2026-10-02","value":54},{"date":"2026-10-05","value":54},{"date":"2026-10-08","value":54},{"date":"2026-10-11","value":54},{"date":"2026-10-14","value":54},{"date":"2026-10-17","value":54},{"date":"2026-10-20","value":54},{"date":"2026-10-23","value":54}]}
