{"metric":"fitness_ctl","points":[{"date":"2025-10-07","value":0.0},{"date":"2025-10-08","value":0.0},{"date":"2025-10-09","value":0.9646608},{"date":"2025-10-10","value":0.941964},{"date":"2025-10-11","value":0.9198012},{"date":"2025-10-12","value":1.8157641},{"date":"2025-10-13","value":1.7730422},{"date":"2025-10-14","value":2.5077598},{"date":"2025-10-15","value":2.4487565},{"date":"2025-10-16","value":2.3911414},{"date":"2025-10-17","value":2.3348818},{"date":"2025-10-18","value":0.79996264},{"date":"2025-10-19","value":0.78114086},{"date":"2025-10-20","value":1.6568378},{"date":"2025-10-21","value":1.6178552},{"date":"2025-10-22","value":2.8267903},{"date":"2025-10-23","value":2.7602806},{"date":"2025-10-24","value":3.1423738},{"date":"2025-10-25","value":3.586062},{"date":"2025-10-26","value":3.501688},{"date":"2025-10-27","value":3.4192991},{"date":"2025-10-28","value":3.3388488},{"date":"2025-10-29","value":4.7190466},{"date":"2025-10-30","value":4.6080155},{"date":"2025-10-31","value":4.4995966},{"date":"2025-11-01","value":5.617201},{"date":"2025-11-02","value":5.485038},{"date":"2025-11-03","value":5.944192},{"date":"2025-11-04","value":7.004279},{"date":"2025-11-05","value":7.5453296},{"date":"2025-11-06","value":8.003065},{"date":"2025-11-07","value":9.344107},{"date":"2025-11-08","value":9.524237},{"date":"2025-11-09","value":10.005997},{"date":"2025-11-10","value":10.852875},{"date":"2025-11-11","value":10.597525},{"date":"2025-11-12","value":10.748164},{"date":"2025-11-13","value":11.154071},{"date":"2025-11-14","value":11.362201},{"date":"2025-11-15","value":11.777188},{"date":"2025-11-16","value":12.229468},{"date":"2025-11-17","value":11.94173},{"date":"2025-11-18","value":12.272497},{"date":"2025-11-19","value":12.360199},{"date":"2025-11-20","value":12.775233},{"date":"2025-11-21","value":13.062861},{"date":"2025-11-22","value":13.320194},{"date":"2025-11-23","value":13.006792},{"date":"2025-11-24","value":13.783067},{"date":"2025-11-25","value":14.046982},{"date":"2025-11-26","value":14.445858},{"date":"2025-11-27","value":14.600066},{"date":"2025-11-28","value":15.432967},{"date":"2025-11-29","value":15.069856},{"date":"2025-11-30","value":15.279967},{"date":"2025-12-01","value":15.3204365},{"date":"2025-12-02","value":15.948162},{"date":"2025-12-03","value":15.572928},{"date":"2025-12-04","value":16.21824},{"date":"2025-12-05","value":16.44839},{"date":"2025-12-06","value":16.061386},{"date":"2025-12-07","value":16.742264},{"date":"2025-12-08","value":16.818913},{"date":"2025-12-09","value":17.034927},{"date":"2025-12-10","value":18.37522},{"date":"2025-12-11","value":17.94288},{"date":"2025-12-12","value":18.650074},{"date":"2025-12-13","value":18.21127},{"date":"2025-12-14","value":18.300411},{"date":"2025-12-15","value":18.952135},{"date":"2025-12-16","value":18.506224},{"date":"2025-12-17","value":18.564898},{"date":"2025-12-18","value":18.763361},{"date":"2025-12-19","value":20.345325},{"date":"2025-12-20","value":19.866634},{"date":"2025-12-21","value":20.552094},{"date":"2025-12-22","value":20.068537},{"date":"2025-12-23","value":20.090452},{"date":"2025-12-24","value":20.770645},{"date":"2025-12-25","value":20.281946},{"date":"2025-12-26","value":19.804747},{"date":"2025-12-27","value":19.338774},{"date":"2025-12-28","value":18.883764},{"date":"2025-12-29","value":18.43946},{"date":"2025-12-30","value":18.005611},{"date":"2025-12-31","value":18.170177}],"schema_version":1,"unit":"load"}
