{"metric":"weight_avg7","points":[{"date":"2026-10-03","value":101.8},{"date":"2026-10-04","value":101.9},{"date":"2026-10-05","value":101.9},{"date":"2026-10-06","value":102.0},{"date":"2026-10-07","value":102.1},{"date":"2026-10-08","value":102.1},{"date":"2026-10-09","value":102.1},{"date":"2026-10-10","value":102.2},{"date":"2026-10-11","value":102.2},{"date":"2026-10-12","value":102.3},{"date":"2026-10-13","value":102.4},{"date":"2026-10-14","value":102.4},{"date":"2026-10-15","value":102.3},{"date":"2026-10-16","value":102.0},{"date":"2026-10-17","value":101.9},{"date":"2026-10-18","value":101.6},{"date":"2026-10-19","value":101.6},{"date":"2026-10-20","value":101.4}],"schema_version":1,"unit":"kg"}
