{"schema_version":1,"metric":"body_fat_pct","unit":"%","points":[{"date":"2025-04-01","value":29.8},{"date":"2025-04-03","value":29.8},{"date":"2025-04-04","value":30.5},{"date":"2025-04-06","value":30.1},{"date":"2025-04-08","value":30.4},{"date":"2025-04-09","value":30.3},{"date":"2025-04-10","value":29.1},{"date":"2025-04-12","value":30.5},{"date":"2025-04-14","value":29.5},{"date":"2025-04-15","value":30},{"date":"2025-04-16","value":29.9},{"date":"2025-04-17","value":29.4},{"date":"2025-04-19","value":29.3},{"date":"2025-04-20","value":29.3},{"date":"2025-04-23","value":29.1},{"date":"2025-04-24","value":30.1},{"date":"2025-04-25","value":29.4},{"date":"2025-04-26","value":29},{"date":"2025-04-27","value":29.4},{"date":"2025-04-28","value":29.2},{"date":"2025-04-29","value":29.4},{"date":"2025-05-01","value":30.3},{"date":"2025-05-03","value":28.9},{"date":"2025-05-04","value":29},{"date":"2025-05-05","value":28.9},{"date":"2025-05-06","value":29},{"date":"2025-05-08","value":29.6},{"date":"2025-05-09","value":29.3},{"date":"2025-05-10","value":28.8},{"date":"2025-05-11","value":29},{"date":"2025-05-12","value":28.8},{"date":"2025-05-14","value":29.3},{"date":"2025-05-15","value":30.2},{"date":"2025-05-16","value":30.1},{"date":"2025-05-20","value":29.7},{"date":"2025-05-21","value":30.3},{"date":"2025-05-22","value":29.8},{"date":"2025-05-23","value":29.7},{"date":"2025-05-25","value":29.7},{"date":"2025-05-26","value":29},{"date":"2025-05-30","value":29.3},{"date":"2025-05-31","value":29.9},{"date":"2025-06-01","value":29.3},{"date":"2025-06-02","value":29.3},{"date":"2025-06-03","value":29.6},{"date":"2025-06-05","value":29.6},{"date":"2025-06-06","value":29.4},{"date":"2025-06-07","value":29.8},{"date":"2025-06-08","value":29.9},{"date":"2025-06-09","value":29.2},{"date":"2025-06-10","value":29.2},{"date":"2025-06-11","value":28.7},{"date":"2025-06-12","value":29.2},{"date":"2025-06-13","value":29.2},{"date":"2025-06-14","value":29.2},{"date":"2025-06-15","value":29.1},{"date":"2025-06-17","value":29.8},{"date":"2025-06-18","value":29.3},{"date":"2025-06-19","value":28.9},{"date":"2025-06-21","value":29.5},{"date":"2025-06-22","value":28.7},{"date":"2025-06-23","value":29.7},{"date":"2025-06-24","value":29.3},{"date":"2025-06-25","value":29.6},{"date":"2025-06-26","value":28.7},{"date":"2025-06-28","value":28.9},{"date":"2025-06-29","value":28.7},{"date":"2025-06-30","value":29.7},{"date":"2025-07-01","value":29.3},{"date":"2025-07-04","value":29.6},{"date":"2025-07-05","value":28.8},{"date":"2025-07-06","value":28.9},{"date":"2025-07-07","value":29},{"date":"2025-07-08","value":29},{"date":"2025-07-09","value":28.5},{"date":"2025-07-10","value":29.4},{"date":"2025-07-11","value":28.6},{"date":"2025-07-12","value":28.4},{"date":"2025-07-13","value":29.4},{"date":"2025-07-14","value":28.2},{"date":"2025-07-16","value":29.6},{"date":"2025-07-18","value":28.9},{"date":"2025-07-21","value":28.2},{"date":"2025-07-22","value":29},{"date":"2025-07-24","value":28.2},{"date":"2025-07-25","value":29.6},{"date":"2025-07-26","value":29.1},{"date":"2025-07-27","value":28.3},{"date":"2025-07-28","value":28.4},{"date":"2025-07-29","value":28.8},{"date":"2025-07-30","value":28.2},{"date":"2025-07-31","value":29.2},{"date":"2025-08-02","value":29.3},{"date":"2025-08-03","value":28.5},{"date":"2025-08-04","value":28.2},{"date":"2025-08-06","value":27.9},{"date":"2025-08-08","value":29.3},{"date":"2025-08-09","value":29.3},{"date":"2025-08-11","value":28.7},{"date":"2025-08-13","value":28.1},{"date":"2025-08-15","value":28.3},{"date":"2025-08-17","value":29.3},{"date":"2025-08-18","value":28.4},{"date":"2025-08-19","value":28.2},{"date":"2025-08-20","value":29.2},{"date":"2025-08-21","value":27.9},{"date":"2025-08-22","value":28.4},{"date":"2025-08-26","value":29.1},{"date":"2025-08-29","value":28.9},{"date":"2025-08-30","value":29.1},{"date":"2025-08-31","value":28.1},{"date":"2025-09-02","value":27.7},{"date":"2025-09-03","value":28},{"date":"2025-09-04","value":29.1},{"date":"2025-09-06","value":28.6},{"date":"2025-09-08","value":28.8},{"date":"2025-09-09","value":27.5},{"date":"2025-09-10","value":28.9},{"date":"2025-09-11","value":27.7},{"date":"2025-09-12","value":29},{"date":"2025-09-13","value":27.7},{"date":"2025-09-15","value":28.1},{"date":"2025-09-16","value":28.9},{"date":"2025-09-17","value":28.2},{"date":"2025-09-20","value":28.8},{"date":"2025-09-21","value":28.8},{"date":"2025-09-22","value":28.2},{"date":"2025-09-26","value":28.2},{"date":"2025-09-27","value":27.4},{"date":"2025-09-29","value":28.7},{"date":"2025-09-30","value":28.7},{"date":"2025-10-02","value":27.8},{"date":"2025-10-03","value":28.8},{"date":"2025-10-06","value":28.5},{"date":"2025-10-08","value":27.9},{"date":"2025-10-09","value":28.4},{"date":"2025-10-10","value":28.7},{"date":"2025-10-11","value":27.9},{"date":"2025-10-13","value":27.4},{"date":"2025-10-14","value":28.6},{"date":"2025-10-18","value":27.8},{"date":"2025-10-19","value":28.7},{"date":"2025-10-23","value":28.5},{"date":"2025-10-24","value":28.2},{"date":"2025-10-25","value":28.2},{"date":"2025-10-26","value":27},{"date":"2025-10-28","value":27.6},{"date":"2025-10-29","value":28.3},{"date":"2025-10-31","value":27},{"date":"2025-11-03","value":27.5},{"date":"2025-11-05","value":28},{"date":"2025-11-06","value":28.1},{"date":"2025-11-07","value":28},{"date":"2025-11-08","value":28},{"date":"2025-11-11","value":27.8},{"date":"2025-11-12","value":27.4},{"date":"2025-11-13","value":26.9},{"date":"2025-11-14","value":27.9},{"date":"2025-11-16","value":27.5},{"date":"2025-11-17","value":27.1},{"date":"2025-11-18","value":26.8},{"date":"2025-11-19","value":28.1},{"date":"2025-11-20","value":27},{"date":"2025-11-21","value":27.6},{"date":"2025-11-22","value":27.6},{"date":"2025-11-23","value":26.8},{"date":"2025-11-24","value":26.9},{"date":"2025-11-25","value":27.1},{"date":"2025-11-26","value":28.2},{"date":"2025-11-28","value":26.8},{"date":"2025-11-29","value":26.8},{"date":"2025-12-01","value":27.6},{"date":"2025-12-02","value":27},{"date":"2025-12-04","value":28},{"date":"2025-12-05","value":26.7},{"date":"2025-12-06","value":26.8},{"date":"2025-12-08","value":26.6},{"date":"2025-12-09","value":27.8},{"date":"2025-12-10","value":28.1},{"date":"2025-12-11","value":26.6},{"date":"2025-12-12","value":26.9},{"date":"2025-12-13","value":27.9},{"date":"2025-12-15","value":27},{"date":"2025-12-16","value":27.9},{"date":"2025-12-17","value":27.4},{"date":"2025-12-19","value":27.9},{"date":"2025-12-20","value":27.4},{"date":"2025-12-21","value":27.9},{"date":"2025-12-23","value":27.7},{"date":"2025-12-24","value":26.9},{"date":"2025-12-26","value":27.5},{"date":"2025-12-27","value":26.6},{"date":"2025-12-28","value":26.7},{"date":"2025-12-29","value":27.7},{"date":"2025-12-30","value":27.2}]}
