{"schema_version":1,"metric":"weight_avg7","unit":"kg","points":[{"date":"2025-04-01","value":110},{"date":"2025-04-02","value":110},{"date":"2025-04-03","value":110},{"date":"2025-04-04","value":110},{"date":"2025-04-05","value":110},{"date":"2025-04-06","value":110},{"date":"2025-04-07","value":110.1},{"date":"2025-04-08","value":110.1},{"date":"2025-04-09","value":110.1},{"date":"2025-04-10","value":110.1},{"date":"2025-04-11","value":110.1},{"date":"2025-04-12","value":110.1},{"date":"2025-04-13","value":110.1},{"date":"2025-04-14","value":110.1},{"date":"2025-04-15","value":110.1},{"date":"2025-04-16","value":110.1},{"date":"2025-04-17","value":110.1},{"date":"2025-04-18","value":110.1},{"date":"2025-04-19","value":110.1},{"date":"2025-04-20","value":110.1},{"date":"2025-04-21","value":110.1},{"date":"2025-04-22","value":110.1},{"date":"2025-04-23","value":110.1},{"date":"2025-04-24","value":110.1},{"date":"2025-04-25","value":110.1},{"date":"2025-04-26","value":110},{"date":"2025-04-27","value":110},{"date":"2025-04-28","value":110},{"date":"2025-04-29","value":110},{"date":"2025-04-30","value":110},{"date":"2025-05-01","value":110},{"date":"2025-05-02","value":109.9},{"date":"2025-05-03","value":109.9},{"date":"2025-05-04","value":109.9},{"date":"2025-05-05","value":109.9},{"date":"2025-05-06","value":109.9},{"date":"2025-05-07","value":109.8},{"date":"2025-05-08","value":109.8},{"date":"2025-05-09","value":109.8},{"date":"2025-05-10","value":109.7},{"date":"2025-05-11","value":109.7},{"date":"2025-05-12","value":109.7},{"date":"2025-05-13","value":109.6},{"date":"2025-05-14","value":109.6},{"date":"2025-05-15","value":109.6},{"date":"2025-05-16","value":109.5},{"date":"2025-05-17","value":109.5},{"date":"2025-05-18","value":109.4},{"date":"2025-05-19","value":109.4},{"date":"2025-05-20","value":109.4},{"date":"2025-05-21","value":109.3},{"date":"2025-05-22","value":109.3},{"date":"2025-05-23","value":109.2},{"date":"2025-05-24","value":109.2},{"date":"2025-05-25","value":109.1},{"date":"2025-05-26","value":109.1},{"date":"2025-05-27","value":109},{"date":"2025-05-28","value":109},{"date":"2025-05-29","value":108.9},{"date":"2025-05-30","value":108.9},{"date":"2025-05-31","value":108.8},{"date":"2025-06-01","value":108.8},{"date":"2025-06-02","value":108.7},{"date":"2025-06-03","value":108.7},{"date":"2025-06-04","value":108.6},{"date":"2025-06-05","value":108.6},{"date":"2025-06-06","value":108.5},{"date":"2025-06-07","value":108.5},{"date":"2025-06-08","value":108.4},{"date":"2025-06-09","value":108.4},{"date":"2025-06-10","value":108.3},{"date":"2025-06-11","value":108.3},{"date":"2025-06-12","value":108.2},{"date":"2025-06-13","value":108.2},{"date":"2025-06-14","value":108.1},{"date":"2025-06-15","value":108.1},{"date":"2025-06-16","value":108},{"date":"2025-06-17","value":108},{"date":"2025-06-18","value":108},{"date":"2025-06-19","value":107.9},{"date":"2025-06-20","value":107.9},{"date":"2025-06-21","value":107.8},{"date":"2025-06-22","value":107.8},{"date":"2025-06-23","value":107.8},{"date":"2025-06-24","value":107.7},{"date":"2025-06-25","value":107.7},{"date":"2025-06-26","value":107.6},{"date":"2025-06-27","value":107.6},{"date":"2025-06-28","value":107.6},{"date":"2025-06-29","value":107.6},{"date":"2025-06-30","value":107.5},{"date":"2025-07-01","value":107.5},{"date":"2025-07-02","value":107.5},{"date":"2025-07-03","value":107.5},{"date":"2025-07-04","value":107.4},{"date":"2025-07-05","value":107.4},{"date":"2025-07-06","value":107.4},{"date":"2025-07-07","value":107.4},{"date":"2025-07-08","value":107.4},{"date":"2025-07-09","value":107.3},{"date":"2025-07-10","value":107.3},{"date":"2025-07-11","value":107.3},{"date":"2025-07-12","value":107.3},{"date":"2025-07-13","value":107.3},{"date":"2025-07-14","value":107.3},{"date":"2025-07-15","value":107.3},{"date":"2025-07-16","value":107.3},{"date":"2025-07-17","value":107.3},{"date":"2025-07-18","value":107.3},{"date":"2025-07-19","value":107.3},{"date":"2025-07-20","value":107.3},{"date":"2025-07-21","value":107.3},{"date":"2025-07-22","value":107.3},{"date":"2025-07-23","value":107.3},{"date":"2025-07-24","value":107.3},{"date":"2025-07-25","value":107.3},{"date":"2025-07-26","value":107.3},{"date":"2025-07-27","value":107.3},{"date":"2025-07-28","value":107.3},{"date":"2025-07-29","value":107.3},{"date":"2025-07-30","value":107.3},{"date":"2025-07-31","value":107.3},{"date":"2025-08-01","value":107.3},{"date":"2025-08-02","value":107.3},{"date":"2025-08-03","value":107.3},{"date":"2025-08-04","value":107.4},{"date":"2025-08-05","value":107.4},{"date":"2025-08-06","value":107.4},{"date":"2025-08-07","value":107.4},{"date":"2025-08-08","value":107.4},{"date":"2025-08-09","value":107.4},{"date":"2025-08-10","value":107.4},{"date":"2025-08-11","value":107.4},{"date":"2025-08-12","value":107.4},{"date":"2025-08-13","value":107.4},{"date":"2025-08-14","value":107.4},{"date":"2025-08-15","value":107.4},{"date":"2025-08-16","value":107.4},{"date":"2025-08-17","value":107.5},{"date":"2025-08-18","value":107.5},{"date":"2025-08-19","value":107.5},{"date":"2025-08-20","value":107.5},{"date":"2025-08-21","value":107.5},{"date":"2025-08-22","value":107.5},{"date":"2025-08-23","value":107.5},{"date":"2025-08-24","value":107.5},{"date":"2025-08-25","value":107.4},{"date":"2025-08-26","value":107.4},{"date":"2025-08-27","value":107.4},{"date":"2025-08-28","value":107.4},{"date":"2025-08-29","value":107.4},{"date":"2025-08-30","value":107.4},{"date":"2025-08-31","value":107.4},{"date":"2025-09-01","value":107.4},{"date":"2025-09-02","value":107.4},{"date":"2025-09-03","value":107.3},{"date":"2025-09-04","value":107.3},{"date":"2025-09-05","value":107.3},{"date":"2025-09-06","value":107.3},{"date":"2025-09-07","value":107.3},{"date":"2025-09-08","value":107.2},{"date":"2025-09-09","value":107.2},{"date":"2025-09-10","value":107.2},{"date":"2025-09-11","value":107.2},{"date":"2025-09-12","value":107.1},{"date":"2025-09-13","value":107.1},{"date":"2025-09-14","value":107.1},{"date":"2025-09-15","value":107},{"date":"2025-09-16","value":107},{"date":"2025-09-17","value":107},{"date":"2025-09-18","value":106.9},{"date":"2025-09-19","value":106.9},{"date":"2025-09-20","value":106.8},{"date":"2025-09-21","value":106.8},{"date":"2025-09-22","value":106.7},{"date":"2025-09-23","value":106.7},{"date":"2025-09-24","value":106.7},{"date":"2025-09-25","value":106.6},{"date":"2025-09-26","value":106.6},{"date":"2025-09-27","value":106.5},{"date":"2025-09-28","value":106.5},{"date":"2025-09-29","value":106.4},{"date":"2025-09-30","value":106.4},{"date":"2025-10-01","value":106.3},{"date":"2025-10-02","value":106.3},{"date":"2025-10-03","value":106.2},{"date":"2025-10-04","value":106.2},{"date":"2025-10-05","value":106.1},{"date":"2025-10-06","value":106.1},{"date":"2025-10-07","value":106},{"date":"2025-10-08","value":106},{"date":"2025-10-09","value":105.9},{"date":"2025-10-10","value":105.9},{"date":"2025-10-11","value":105.8},{"date":"2025-10-12","value":105.8},{"date":"2025-10-13","value":105.7},{"date":"2025-10-14","value":105.7},{"date":"2025-10-15","value":105.6},{"date":"2025-10-16","value":105.6},{"date":"2025-10-17","value":105.5},{"date":"2025-10-18","value":105.5},{"date":"2025-10-19","value":105.4},{"date":"2025-10-20","value":105.4},{"date":"2025-10-21","value":105.3},{"date":"2025-10-22","value":105.3},{"date":"2025-10-23","value":105.3},{"date":"2025-10-24","value":105.2},{"date":"2025-10-25","value":105.2},{"date":"2025-10-26","value":105.1},{"date":"2025-10-27","value":105.1},{"date":"2025-10-28","value":105.1},{"date":"2025-10-29","value":105},{"date":"2025-10-30","value":105},{"date":"2025-10-31","value":105},{"date":"2025-11-01","value":104.9},{"date":"2025-11-02","value":104.9},{"date":"2025-11-03","value":104.9},{"date":"2025-11-04","value":104.9},{"date":"2025-11-05","value":104.8},{"date":"2025-11-06","value":104.8},{"date":"2025-11-07","value":104.8},{"date":"2025-11-08","value":104.8},{"date":"2025-11-09","value":104.7},{"date":"2025-11-10","value":104.7},{"date":"2025-11-11","value":104.7},{"date":"2025-11-12","value":104.7},{"date":"2025-11-13","value":104.7},{"date":"2025-11-14","value":104.7},{"date":"2025-11-15","value":104.7},{"date":"2025-11-16","value":104.7},{"date":"2025-11-17","value":104.6},{"date":"2025-11-18","value":104.6},{"date":"2025-11-19","value":104.6},{"date":"2025-11-20","value":104.6},{"date":"2025-11-21","value":104.6},{"date":"2025-11-22","value":104.6},{"date":"2025-11-23","value":104.6},{"date":"2025-11-24","value":104.6},{"date":"2025-11-25","value":104.6},{"date":"2025-11-26","value":104.6},{"date":"2025-11-27","value":104.6},{"date":"2025-11-28","value":104.6},{"date":"2025-11-29","value":104.7},{"date":"2025-11-30","value":104.7},{"date":"2025-12-01","value":104.7},{"date":"2025-12-02","value":104.7},{"date":"2025-12-03","value":104.7},{"date":"2025-12-04","value":104.7},{"date":"2025-12-05","value":104.7},{"date":"2025-12-06","value":104.7},{"date":"2025-12-07","value":104.7},{"date":"2025-12-08","value":104.7},{"date":"2025-12-09","value":104.7},{"date":"2025-12-10","value":104.7},{"date":"2025-12-11","value":104.8},{"date":"2025-12-12","value":104.8},{"date":"2025-12-13","value":104.8},{"date":"2025-12-14","value":104.8},{"date":"2025-12-15","value":104.8},{"date":"2025-12-16","value":104.8},{"date":"2025-12-17","value":104.8},{"date":"2025-12-18","value":104.8},{"date":"2025-12-19","value":104.8},{"date":"2025-12-20","value":104.8},{"date":"2025-12-21","value":104.8},{"date":"2025-12-22","value":104.8},{"date":"2025-12-23","value":104.8},{"date":"2025-12-24","value":104.8},{"date":"2025-12-25","value":104.8},{"date":"2025-12-26","value":104.8},{"date":"2025-12-27","value":104.8},{"date":"2025-12-28","value":104.8},{"date":"2025-12-29","value":104.8},{"date":"2025-12-30","value":104.8},{"date":"2025-12-31","value":104.8}]}
