{"metric":"hrv","points":[{"date":"2025-12-01","value":45.0},{"date":"2025-12-02","value":54.0},{"date":"2025-12-04","value":43.0},{"date":"2025-12-05","value":40.0},{"date":"2025-12-06","value":40.0},{"date":"2025-12-07","value":42.0},{"date":"2025-12-08","value":56.0},{"date":"2025-12-09","value":54.0},{"date":"2025-12-10","value":46.0},{"date":"2025-12-11","value":42.0},{"date":"2025-12-12","value":48.0},{"date":"2025-12-13","value":53.0},{"date":"2025-12-14","value":50.0},{"date":"2025-12-15","value":53.0},{"date":"2025-12-16","value":39.0},{"date":"2025-12-17","value":49.0},{"date":"2025-12-18","value":49.0},{"date":"2025-12-19","value":46.0},{"date":"2025-12-20","value":41.0},{"date":"2025-12-21","value":48.0},{"date":"2025-12-22","value":43.0},{"date":"2025-12-23","value":43.0},{"date":"2025-12-24","value":52.0},{"date":"2025-12-25","value":54.0},{"date":"2025-12-26","value":32.0},{"date":"2025-12-27","value":40.0},{"date":"2025-12-28","value":53.0},{"date":"2025-12-29","value":37.0},{"date":"2025-12-30","value":48.0},{"date":"2025-12-31","value":40.0}],"schema_version":1,"unit":"ms"}
